{
  "schemaVersion": 1,
  "recordId": "approval-valid-exact-action",
  "taskId": "HQ-114",
  "approvalState": "approved_exact_action",
  "owner": "Captain",
  "selectedTarget": {
    "targetType": "fixture",
    "targetId": "FixtureOnlyDemoProject",
    "singleTargetOnly": true
  },
  "repoPathRequired": true,
  "repoPath": "C:\\Dev\\codex-fleet\\.codex-local\\fixtures\\demo-trial\\FixtureOnlyDemoProject",
  "entrypoint": "fixture-only-demo-readiness-example",
  "action": "manual read-only single-project inspection only",
  "commandList": [
    "fixture-only no-op shape check"
  ],
  "expectedOutput": [
    ".codex-local/fixtures/demo-trial/evidence/fixture-report.md"
  ],
  "approvedAt": "2026-06-02T12:00:00Z",
  "expiresAt": "2026-06-02T12:30:00Z",
  "stopConditions": [
    "stop if target, repo path, entrypoint, command, owner, or output differs",
    "stop if any command becomes write-capable or external-side-effect capable"
  ],
  "approvalChannel": "local_desktop",
  "validationDecision": "valid_exact_action",
  "denialReason": null,
  "reuseStatus": "fresh",
  "nonAuthorityNotice": "This fixture approval is schema evidence only and cannot approve execution or product-repo work."
}
